{
  "schema_version": 1,
  "exam_code": "SECURITY-PLUS-SAMPLE",
  "edition": "v7",
  "release_label": "v7-sample.1",
  "categories": [
    {
      "slug": "general-concepts",
      "name": "General security concepts",
      "weight": 12
    },
    {
      "slug": "threats",
      "name": "Threats & mitigations",
      "weight": 22
    },
    {
      "slug": "architecture",
      "name": "Security architecture",
      "weight": 18
    },
    {
      "slug": "operations",
      "name": "Security operations",
      "weight": 28
    },
    {
      "slug": "governance",
      "name": "Governance & oversight",
      "weight": 20
    }
  ],
  "questions": [
    {
      "external_id": "sample-0001",
      "category_slug": "general-concepts",
      "objective_code": "SAMPLE-1",
      "prompt": "A help-desk employee needs to reset passwords but should not manage network devices. Which principle should guide their permissions?",
      "choices": [
        {
          "id": "choice-1",
          "text": "Least privilege"
        },
        {
          "id": "choice-2",
          "text": "High availability"
        },
        {
          "id": "choice-3",
          "text": "Obfuscation"
        },
        {
          "id": "choice-4",
          "text": "Redundancy"
        }
      ],
      "correct_choice_id": "choice-1",
      "explanation_technical": "Grant only the permissions necessary for the assigned role. Reducing unnecessary access also limits the impact of an account compromise.",
      "explanation_eli5": "Give someone keys only to the rooms they need.",
      "difficulty": "basic",
      "tags": ["synthetic-sample"],
      "source_reference": "Original illustrative question. Confirm mapping against your booked exam objectives.",
      "change_note": "Initial synthetic sample"
    },
    {
      "external_id": "sample-0002",
      "category_slug": "general-concepts",
      "objective_code": "SAMPLE-1",
      "prompt": "A company wants to detect whether a downloaded file was modified. Which mechanism best supports this check?",
      "choices": [
        {
          "id": "choice-1",
          "text": "A cryptographic hash compared with a trusted value"
        },
        {
          "id": "choice-2",
          "text": "A longer filename"
        },
        {
          "id": "choice-3",
          "text": "A compressed archive alone"
        },
        {
          "id": "choice-4",
          "text": "A public IP address"
        }
      ],
      "correct_choice_id": "choice-1",
      "explanation_technical": "A cryptographic hash provides a fingerprint of the file. Comparing it with a trusted expected hash can detect a change; an untrusted hash alongside a malicious file does not establish authenticity.",
      "explanation_eli5": "Compare the package with a trusted fingerprint to see whether anything changed.",
      "difficulty": "basic",
      "tags": ["synthetic-sample"],
      "source_reference": "Original illustrative question. Confirm mapping against your booked exam objectives.",
      "change_note": "Initial synthetic sample"
    },
    {
      "external_id": "sample-0003",
      "category_slug": "general-concepts",
      "objective_code": "SAMPLE-1",
      "prompt": "An employee uses a password and a physical security key to sign in. What does this demonstrate?",
      "choices": [
        {
          "id": "choice-1",
          "text": "Multifactor authentication"
        },
        {
          "id": "choice-2",
          "text": "Two passwords"
        },
        {
          "id": "choice-3",
          "text": "Network segmentation"
        },
        {
          "id": "choice-4",
          "text": "Single-factor authentication"
        }
      ],
      "correct_choice_id": "choice-1",
      "explanation_technical": "A password is something the user knows, while a physical security key is something they possess. These are distinct authentication factors.",
      "explanation_eli5": "You need both a secret you know and a key you carry.",
      "difficulty": "basic",
      "tags": ["synthetic-sample"],
      "source_reference": "Original illustrative question. Confirm mapping against your booked exam objectives.",
      "change_note": "Initial synthetic sample"
    },
    {
      "external_id": "sample-0004",
      "category_slug": "general-concepts",
      "objective_code": "SAMPLE-1",
      "prompt": "Which security objective is primarily affected when a service becomes unreachable during an outage?",
      "choices": [
        {
          "id": "choice-1",
          "text": "Availability"
        },
        {
          "id": "choice-2",
          "text": "Confidentiality"
        },
        {
          "id": "choice-3",
          "text": "Non-repudiation"
        },
        {
          "id": "choice-4",
          "text": "Data classification"
        }
      ],
      "correct_choice_id": "choice-1",
      "explanation_technical": "Availability concerns timely, reliable access to systems and data. An outage prevents legitimate users from accessing the service.",
      "explanation_eli5": "A locked-up shop cannot serve customers, even when everything inside is safe.",
      "difficulty": "basic",
      "tags": ["synthetic-sample"],
      "source_reference": "Original illustrative question. Confirm mapping against your booked exam objectives.",
      "change_note": "Initial synthetic sample"
    },
    {
      "external_id": "sample-0005",
      "category_slug": "general-concepts",
      "objective_code": "SAMPLE-1",
      "prompt": "Which control is primarily detective?",
      "choices": [
        {
          "id": "choice-1",
          "text": "Reviewing authentication logs for unusual sign-ins"
        },
        {
          "id": "choice-2",
          "text": "Blocking an unauthorized network port"
        },
        {
          "id": "choice-3",
          "text": "Encrypting a database backup"
        },
        {
          "id": "choice-4",
          "text": "Requiring a badge to enter a room"
        }
      ],
      "correct_choice_id": "choice-1",
      "explanation_technical": "Reviewing logs identifies activity that has occurred. Preventive controls instead attempt to stop unwanted activity before it succeeds.",
      "explanation_eli5": "A camera recording helps you notice what happened; a locked door helps stop it.",
      "difficulty": "basic",
      "tags": ["synthetic-sample"],
      "source_reference": "Original illustrative question. Confirm mapping against your booked exam objectives.",
      "change_note": "Initial synthetic sample"
    },
    {
      "external_id": "sample-0006",
      "category_slug": "general-concepts",
      "objective_code": "SAMPLE-1",
      "prompt": "Why should password storage use a unique salt with a password hashing function?",
      "choices": [
        {
          "id": "choice-1",
          "text": "To make identical passwords produce different stored results"
        },
        {
          "id": "choice-2",
          "text": "To allow administrators to decrypt passwords"
        },
        {
          "id": "choice-3",
          "text": "To eliminate the need for a password hashing function"
        },
        {
          "id": "choice-4",
          "text": "To make passwords public"
        }
      ],
      "correct_choice_id": "choice-1",
      "explanation_technical": "A unique salt prevents equal passwords from sharing the same stored hash and reduces the utility of precomputed hash tables. A deliberately expensive password hashing function is still necessary.",
      "explanation_eli5": "Mix a different ingredient into each password before making its fingerprint.",
      "difficulty": "basic",
      "tags": ["synthetic-sample"],
      "source_reference": "Original illustrative question. Confirm mapping against your booked exam objectives.",
      "change_note": "Initial synthetic sample"
    },
    {
      "external_id": "sample-0007",
      "category_slug": "threats",
      "objective_code": "SAMPLE-2",
      "prompt": "A message impersonates payroll and directs an employee to a fake sign-in page. What is the attack?",
      "choices": [
        {
          "id": "choice-1",
          "text": "Phishing"
        },
        {
          "id": "choice-2",
          "text": "Load balancing"
        },
        {
          "id": "choice-3",
          "text": "Patch management"
        },
        {
          "id": "choice-4",
          "text": "Data deduplication"
        }
      ],
      "correct_choice_id": "choice-1",
      "explanation_technical": "Phishing uses deceptive communication to induce a victim to disclose information or perform an unsafe action. An impersonated login page is a common credential theft mechanism.",
      "explanation_eli5": "Someone wears a fake uniform to trick you into handing over a key.",
      "difficulty": "basic",
      "tags": ["synthetic-sample"],
      "source_reference": "Original illustrative question. Confirm mapping against your booked exam objectives.",
      "change_note": "Initial synthetic sample"
    },
    {
      "external_id": "sample-0008",
      "category_slug": "threats",
      "objective_code": "SAMPLE-2",
      "prompt": "An attacker enters SQL syntax into a form to change the meaning of a database query. What is the best primary coding defense?",
      "choices": [
        {
          "id": "choice-1",
          "text": "Parameterized queries"
        },
        {
          "id": "choice-2",
          "text": "Renaming database tables"
        },
        {
          "id": "choice-3",
          "text": "Changing the page color"
        },
        {
          "id": "choice-4",
          "text": "Hiding the submit button"
        }
      ],
      "correct_choice_id": "choice-1",
      "explanation_technical": "Parameterized queries separate data values from SQL instructions. User input is bound as data rather than concatenated into executable query text.",